date,event,source,official_source_url
2020-12-11,Pfizer-BioNTech COVID-19 Vaccine granted EUA for 16+,"FDA Press Release (Dec 11, 2020)",https://www.fda.gov/news-events/press-announcements/fda-approves-first-covid-19-vaccine
2020-12-18,Moderna COVID-19 Vaccine granted EUA for 18+,"Federal Register EUA Notice (Dec 18, 2020)",https://www.federalregister.gov/documents/2021/01/19/2021-01022/authorizations-of-emergency-use-of-two-biological-products-during-the-covid-19-pandemic-availability
2021-02-27,Johnson & Johnson (Janssen) Vaccine granted EUA (single-shot),"Johnson & Johnson Press Release (Feb 27, 2021)",https://www.jnj.com/media-center/press-releases/johnson-johnson-covid-19-vaccine-authorized-by-u-s-fda-for-emergency-usefirst-single-shot-vaccine-in-fight-against-global-pandemic
2021-04-19,All U.S. adults (18+) eligible for vaccination,"CDC / HHS Announcement (Apr 19, 2021)",https://www.hhs.gov/coronavirus/covid-19-vaccines/index.html
2021-05-10,Pfizer-BioNTech EUA expanded to ages 12-15,"FDA Announcement (May 10, 2021)",https://www.fda.gov/news-events/press-announcements/fda-approves-first-covid-19-vaccine
2022-08-31,FDA authorizes bivalent (Original + Omicron) mRNA boosters,"FDA Announcement (Aug 31, 2022)",https://www.fda.gov/news-events/press-announcements/fda-approves-and-authorizes-updated-mrna-covid-19-vaccines-better-protect-against-currently
